{
  "$schema": "https://json-schema.org/draft/2020-12/schema",
  "title": "MotionScript Transcript",
  "type": "object",
  "required": ["language", "duration", "segments"],
  "properties": {
    "revision": { "type": "integer", "minimum": 1 },
    "language": { "type": "string" },
    "duration": { "type": "number", "minimum": 0 },
    "source": { "enum": ["supplied", "chatcut", "local-stt"] },
    "segments": {
      "type": "array",
      "items": {
        "type": "object",
        "required": ["id", "text", "start", "end", "words"],
        "properties": {
          "id": { "type": "string" },
          "text": { "type": "string" },
          "start": { "type": "number", "minimum": 0 },
          "end": { "type": "number", "minimum": 0 },
          "confidence": { "type": ["number", "null"], "minimum": 0, "maximum": 1 },
          "words": {
            "type": "array",
            "items": {
              "type": "object",
              "required": ["text", "start", "end"],
              "properties": {
                "id": { "type": "string" },
                "text": { "type": "string" },
                "start": { "type": "number", "minimum": 0 },
                "end": { "type": "number", "minimum": 0 },
                "confidence": { "type": ["number", "null"], "minimum": 0, "maximum": 1 }
              }
            }
          }
        }
      }
    }
  }
}
